{
  "version": "1.0.0",
  "currency": "CNY",
  "categories": [
    {
      "slug": "home",
      "name": "居家生活",
      "subtitle": "让家更像自己",
      "icon": "sofa",
      "sort_order": 1
    },
    {
      "slug": "digital",
      "name": "数码影音",
      "subtitle": "把声音与光带在身边",
      "icon": "headphones",
      "sort_order": 2
    },
    {
      "slug": "outdoor",
      "name": "户外出行",
      "subtitle": "往更远的地方走",
      "icon": "tent",
      "sort_order": 3
    },
    {
      "slug": "kitchen",
      "name": "厨房餐厨",
      "subtitle": "认真做一顿饭",
      "icon": "pot",
      "sort_order": 4
    },
    {
      "slug": "style",
      "name": "穿着配饰",
      "subtitle": "穿得舒服，也好看",
      "icon": "jacket",
      "sort_order": 5
    },
    {
      "slug": "care",
      "name": "美妆个护",
      "subtitle": "照顾自己的日常",
      "icon": "serum",
      "sort_order": 6
    },
    {
      "slug": "smart",
      "name": "智能家电",
      "subtitle": "让家务轻一点",
      "icon": "robot",
      "sort_order": 7
    },
    {
      "slug": "gift",
      "name": "文创礼物",
      "subtitle": "送得出去的心意",
      "icon": "notebook",
      "sort_order": 8
    }
  ],
  "shops": [
    {
      "slug": "openshop-self",
      "name": "OpenShop 自营",
      "kind": "self",
      "tagline": "官方选品，仓配直达",
      "story": "自营选品从材料、做工与日常使用三个角度过一遍，入仓前再做抽检。上海嘉定仓发出，售后由开集客服直接处理。",
      "rating": 4.9,
      "followers_count": 18230,
      "since": "2021",
      "verified": true,
      "response_rate": "99.6%",
      "ship_from": "上海 · 嘉定"
    },
    {
      "slug": "shanwu-home",
      "name": "山雾家居旗舰店",
      "kind": "brand",
      "tagline": "把山里的慢，带回家",
      "story": "山雾在杭州做木与织物的家具，打样时间常常比销售周期还长。沙发、灯具与小件共用一条质检线，每批只做少量。",
      "rating": 4.8,
      "followers_count": 9360,
      "since": "2019",
      "verified": true,
      "response_rate": "98.9%",
      "ship_from": "浙江 · 杭州"
    },
    {
      "slug": "direct-craft",
      "name": "直造生活工厂店",
      "kind": "factory",
      "tagline": "同样的材料，去掉多余加价",
      "story": "直造在佛山有木作、五金与织物三条小线，也为独立品牌代工。工厂店按批次卖标准款，交期通常比品牌线多两三天。",
      "rating": 4.7,
      "followers_count": 25800,
      "since": "2020",
      "verified": true,
      "response_rate": "97.4%",
      "ship_from": "广东 · 佛山"
    },
    {
      "slug": "echo-lab",
      "name": "回声影音专营店",
      "kind": "brand",
      "tagline": "给耳朵一间安静的房",
      "story": "回声在苏州做个人声学设备，调音师会带着样机坐完一整段地铁。耳罩和固件都保留可更换、可更新的余地。",
      "rating": 4.8,
      "followers_count": 7610,
      "since": "2022",
      "verified": true,
      "response_rate": "99.1%",
      "ship_from": "江苏 · 苏州"
    },
    {
      "slug": "northisle-outdoor",
      "name": "北屿户外旗舰店",
      "kind": "brand",
      "tagline": "把周末过成一次远行",
      "story": "北屿从宁波出发，做能装进后备箱的轻量桌椅与背包。设计团队每年沿东海走一段长线，回来改一次结构。",
      "rating": 4.8,
      "followers_count": 11280,
      "since": "2018",
      "verified": true,
      "response_rate": "98.7%",
      "ship_from": "浙江 · 宁波"
    },
    {
      "slug": "wayline-kitchen",
      "name": "未行厨房旗舰店",
      "kind": "brand",
      "tagline": "慢火与好器",
      "story": "未行在金华做厨房器物，和几家小窑口、铸锅作坊长期合作。需要手工修整的壶嘴和锅沿，我们都留着手作的余地。",
      "rating": 4.8,
      "followers_count": 6840,
      "since": "2020",
      "verified": true,
      "response_rate": "98.2%",
      "ship_from": "浙江 · 金华"
    },
    {
      "slug": "suzhi-atelier",
      "name": "素织衣着工作室",
      "kind": "brand",
      "tagline": "穿得像自己，穿得久一点",
      "story": "素织在南通做小批量成衣。每一季只加少数几个版型，用可以反复水洗的棉麻，把尺码与布料克重写清楚。",
      "rating": 4.7,
      "followers_count": 5260,
      "since": "2021",
      "verified": true,
      "response_rate": "97.9%",
      "ship_from": "江苏 · 南通"
    },
    {
      "slug": "qingwu-care",
      "name": "青芜个护旗舰店",
      "kind": "brand",
      "tagline": "照顾日常，不必费力",
      "story": "青芜在湖州做小批量个护与日用器物，香精用量克制，包装尽量可回收。客服会把成分与使用方法讲明白。",
      "rating": 4.8,
      "followers_count": 8930,
      "since": "2022",
      "verified": true,
      "response_rate": "99.3%",
      "ship_from": "浙江 · 湖州"
    },
    {
      "slug": "xiaoman-electric",
      "name": "小满电器旗舰店",
      "kind": "brand",
      "tagline": "把家务做轻一点",
      "story": "小满在顺德做安静的小家电。风扇与加湿器都以可拆洗、低噪声为目标，说明书里直接写明耗材与保养方式。",
      "rating": 4.7,
      "followers_count": 14760,
      "since": "2019",
      "verified": true,
      "response_rate": "98.5%",
      "ship_from": "广东 · 顺德"
    },
    {
      "slug": "zhijian-gift",
      "name": "纸间礼物店",
      "kind": "brand",
      "tagline": "给心意一个合适的大小",
      "story": "纸间在上海松江做纸品与木作小物，和独立印厂、木工房一起开发。包装尽量只留一层，把可以留用的部分留给收礼的人。",
      "rating": 4.9,
      "followers_count": 4320,
      "since": "2023",
      "verified": true,
      "response_rate": "99.4%",
      "ship_from": "上海 · 松江"
    }
  ],
  "users": [
    {
      "handle": "demo_buyer",
      "display_name": "林澄",
      "email": "buyer@openshop.demo",
      "role": "buyer",
      "avatar": "/web/assets/brand/avatar-lin.svg",
      "member_since": "2024-03-18",
      "coupons": [
        "HELLO20",
        "HOME60"
      ],
      "addresses": [
        {
          "label": "家",
          "receiver": "林澄",
          "phone": "13800000002",
          "province": "上海市",
          "city": "上海市",
          "district": "徐汇区",
          "detail": "漕溪北路 88 号 6 栋 502",
          "is_default": true
        }
      ]
    },
    {
      "handle": "demo_buyer_two",
      "display_name": "许岚",
      "email": "buyer2@openshop.demo",
      "role": "buyer",
      "avatar": "/web/assets/brand/avatar-xu.svg",
      "member_since": "2025-06-09",
      "coupons": [
        "HELLO20"
      ],
      "addresses": [
        {
          "label": "家",
          "receiver": "许岚",
          "phone": "13800000003",
          "province": "浙江省",
          "city": "杭州市",
          "district": "西湖区",
          "detail": "文三路 199 号 2 幢 801",
          "is_default": true
        }
      ]
    },
    {
      "handle": "demo_seller",
      "display_name": "周屿",
      "email": "seller@openshop.demo",
      "role": "seller",
      "avatar": "/web/assets/brand/avatar-zhou.svg",
      "member_since": "2023-08-02",
      "shop": "openshop-self"
    }
  ],
  "coupons": [
    {
      "code": "FIRST12",
      "title": "初见见面礼",
      "description": "无门槛减 ¥12",
      "threshold_cents": 0,
      "discount_cents": 1200,
      "scope": "all",
      "valid_days": 30,
      "auto_claim_new_user": true,
      "quantity": 2000
    },
    {
      "code": "HELLO20",
      "title": "新人见面礼",
      "description": "满 ¥199 减 ¥20",
      "threshold_cents": 19900,
      "discount_cents": 2000,
      "scope": "all",
      "valid_days": 30,
      "auto_claim_new_user": true,
      "quantity": 1000
    },
    {
      "code": "HOME60",
      "title": "把家安顿好",
      "description": "居家满 ¥499 减 ¥60",
      "threshold_cents": 49900,
      "discount_cents": 6000,
      "scope": "category:home",
      "valid_days": 21,
      "auto_claim_new_user": false,
      "quantity": 500
    },
    {
      "code": "WEEKEND30",
      "title": "周末出门去",
      "description": "全场满 ¥299 减 ¥30",
      "threshold_cents": 29900,
      "discount_cents": 3000,
      "scope": "all",
      "valid_days": 14,
      "auto_claim_new_user": false,
      "quantity": 800
    }
  ],
  "products": [
    {
      "slug": "cloud-sofa",
      "title": "云朵模块沙发",
      "subtitle": "可组合的松弛角落",
      "brand": "山雾 SHANWU",
      "category": "home",
      "description": "更深的坐深，更慢的回弹。双人位可以拆成单人椅，也能加购贵妃位，把客厅留给真正的生活。",
      "story": "我们花了很多时间推翻扶手。最后留下一个刚好能靠住的弧度，也给客厅留出呼吸的空白。",
      "tags": [
        "模块化",
        "小户型友好",
        "可拆洗",
        "客厅"
      ],
      "badges": [
        "原创设计",
        "送装一体"
      ],
      "art": {
        "cover": "/web/assets/products/cloud-sofa.svg",
        "cover_alt": "暖灰模块沙发、纸灯与午后窗光组成的客厅插画",
        "images": [
          {
            "src": "/web/assets/products/cloud-sofa.svg",
            "alt": "暖灰模块沙发、纸灯与午后窗光组成的客厅插画"
          },
          {
            "src": "/web/assets/products/cloud-sofa-detail.svg",
            "alt": "圈绒座面、缝线与白蜡木沙发脚的特写插画"
          }
        ]
      },
      "flags": {
        "hero": true,
        "featured": true,
        "new": true
      },
      "sold_count": 128,
      "highlights": [
        {
          "title": "一坐就陷进去的云感",
          "body": "高回弹海绵与羽绒混合填充，坐深 62cm，盘腿坐也舒展。"
        },
        {
          "title": "能跟着生活搬家",
          "body": "双人位模块可拆分，改成单人椅或加购贵妃位都不费力。"
        },
        {
          "title": "看不见的稳妥",
          "body": "桦木框架经过含水率检测，底部防滑脚垫保护木地板。"
        }
      ],
      "specs": [
        {
          "title": "尺寸与材质",
          "items": [
            {
              "label": "面料",
              "value": "混纺圈绒"
            },
            {
              "label": "框架",
              "value": "实木桦木"
            },
            {
              "label": "双人位尺寸",
              "value": "180 × 95 × 72cm"
            },
            {
              "label": "坐深",
              "value": "62cm"
            }
          ]
        },
        {
          "title": "交付",
          "items": [
            {
              "label": "安装",
              "value": "送装一体"
            },
            {
              "label": "包装",
              "value": "可回收牛皮纸与蜂窝板"
            }
          ]
        }
      ],
      "detail_sections": [
        {
          "title": "把客厅留给松弛",
          "body": "不做看起来昂贵但坐不住的家具。宽坐面、软靠背和可拆洗外套，让它适应真实生活里的每个姿势。"
        }
      ],
      "faq": [
        {
          "q": "是否支持拆洗？",
          "a": "外套可拆洗，建议低温手洗或专业干洗，避免高温烘干。"
        },
        {
          "q": "可以只买单人位吗？",
          "a": "模块支持单独购买，请联系店铺客服登记需求。"
        }
      ],
      "skus": [
        {
          "name": "雾灰 / 双人位",
          "options": {
            "颜色": "雾灰",
            "规格": "双人位"
          },
          "price_delta_cents": 0
        },
        {
          "name": "燕麦 / 双人位",
          "options": {
            "颜色": "燕麦",
            "规格": "双人位"
          },
          "price_delta_cents": 20000
        },
        {
          "name": "雾灰 / 三人位",
          "options": {
            "颜色": "雾灰",
            "规格": "三人位"
          },